{
  "format": "overlay-timeline/1",
  "start": 0,
  "end": 64.0,
  "segments": [
    { "label": "WALK", "line": "SUBTASK #1: WALK TO THE COUNTER", "start": 0, "end": 12.5, "budget": 12.5, "status": "success" },
    { "label": "FIND", "line": "SUBTASK #2: FIND THE BLUE MUG", "start": 12.5, "end": 21.0, "budget": 8.5, "status": "success" },
    { "label": "PICK", "line": "SUBTASK #3: PICK UP THE BLUE MUG", "start": 21.0, "end": 38.5, "budget": 17.5, "status": "success" },
    { "label": "CARRY", "line": "SUBTASK #4: BRING IT TO TABLE 7", "start": 38.5, "end": 55.0, "budget": 16.5, "status": "success" },
    { "label": "SERVE", "line": "SUBTASK #5: SET IT DOWN AT TABLE 7", "start": 55.0, "end": 64.0, "budget": 9.0, "status": "failure" }
  ],
  "calls": [
    { "id": 1, "parent": null, "name": "check_battery", "start": 0.4, "end": 0.6, "status": "finished", "hidden": true,
      "fields": [], "running_fields": [] },
    { "id": 2, "parent": null, "name": "drive_to", "start": 1.0, "end": 12.1, "status": "finished",
      "fields": [ { "key": "PLACE", "value": "counter", "warn": false }, { "key": "RESULT", "value": "ARRIVED", "warn": false } ],
      "running_fields": [ { "key": "PLACE", "value": "counter", "warn": false } ] },
    { "id": 3, "parent": null, "name": "look_for", "start": 13.0, "end": 15.2, "status": "finished", "drop_at": 16.0,
      "fields": [ { "key": "ITEM", "value": "blue mug", "warn": false }, { "key": "SEEN", "value": "no", "warn": true } ],
      "running_fields": [ { "key": "ITEM", "value": "blue mug", "warn": false } ] },
    { "id": 4, "parent": null, "name": "look_for", "start": 16.0, "end": 20.4, "status": "finished",
      "fields": [ { "key": "ITEM", "value": "blue mug", "warn": false }, { "key": "RESULT", "value": "FOUND", "warn": false } ],
      "running_fields": [ { "key": "ITEM", "value": "blue mug", "warn": false } ] },
    { "id": 5, "parent": null, "name": "pick_up", "start": 21.5, "end": 38.0, "status": "finished",
      "fields": [ { "key": "ITEM", "value": "blue mug", "warn": false }, { "key": "RESULT", "value": "HOLDING · 4 stages", "warn": false } ],
      "running_fields": [ { "key": "ITEM", "value": "blue mug", "warn": false } ] },
    { "id": 6, "parent": 5, "name": "approach", "start": 21.5, "end": 26.0, "status": "finished",
      "fields": [ { "key": "DISTANCE", "value": "0.40 m", "warn": false }, { "key": "RESULT", "value": "IN REACH", "warn": false } ],
      "running_fields": [ { "key": "DISTANCE", "value": "0.40 m", "warn": false } ] },
    { "id": 7, "parent": 5, "name": "reach", "start": 26.0, "end": 31.5, "status": "finished",
      "fields": [ { "key": "HANDLE", "value": "left", "warn": false }, { "key": "RESULT", "value": "TOUCHING", "warn": false } ],
      "running_fields": [ { "key": "HANDLE", "value": "left", "warn": false } ] },
    { "id": 8, "parent": 5, "name": "close_gripper", "start": 31.5, "end": 34.0, "status": "finished",
      "fields": [ { "key": "FORCE", "value": "12 N", "warn": false }, { "key": "RESULT", "value": "CLOSED", "warn": false } ],
      "running_fields": [ { "key": "FORCE", "value": "12 N", "warn": false } ] },
    { "id": 9, "parent": 5, "name": "lift", "start": 34.0, "end": 38.0, "status": "finished",
      "fields": [ { "key": "HEIGHT", "value": "0.15 m", "warn": false }, { "key": "RESULT", "value": "LIFTED", "warn": false } ],
      "running_fields": [ { "key": "HEIGHT", "value": "0.15 m", "warn": false } ] },
    { "id": 10, "parent": null, "name": "drive_to", "start": 39.0, "end": 54.5, "status": "finished",
      "fields": [ { "key": "PLACE", "value": "table 7", "warn": false }, { "key": "RESULT", "value": "ARRIVED", "warn": false } ],
      "running_fields": [ { "key": "PLACE", "value": "table 7", "warn": false } ] },
    { "id": 11, "parent": null, "name": "set_down", "start": 55.5, "end": 63.0, "status": "failed",
      "fields": [ { "key": "SURFACE", "value": "table 7", "warn": false }, { "key": "RESULT", "value": "FAILED", "warn": true } ],
      "running_fields": [ { "key": "SURFACE", "value": "table 7", "warn": false } ] }
  ],
  "outages": [ { "kind": "robot", "start": 45.0, "end": 48.0 } ],
  "show": { "hidden_between_runs": true, "outro_after_s": 5 }
}
